,summary,finalRatingStatus
62938,"This is false.    The artificial island project presented by Israeli Foreign Minister Katz is intended to be a transport hub and an industrial zone, and not &quot;an island for the Palestinians&quot;    https://www.jpost.com/israel-hamas-war/article-783199#:~:text=Such%20an%20island%20could%20harbor%20a%20maritime%20port%2C%20an%20airport%2C%20a%20desalination%20plant%2C%20and%20an%20industrial%20zone    https://www.reuters.com/article/idUSKBN19J1XV/",CURRENTLY_RATED_HELPFUL
96344,This is not a letter from the United States Senate but rather from a group of 12 Republican senators.    https://www.thegatewaypundit.com/2024/05/republican-senators-warn-icc-chief-prosecutor-regarding-netanyahu/?utm_source=rss&amp;utm_medium=rss&amp;utm_campaign=republican-senators-warn-icc-chief-prosecutor-regarding-netanyahu,CURRENTLY_RATED_HELPFUL
95591,This is a digitally altered photo. Previous versions of this photo can be found as far back as December 2023:  https://www.dailymail.co.uk/sport/mma/article-12900523/Israeli-MMA-fighter-Haim-Gozali-takes-credit-Kanye-Wests-written-IDF.html  https://www.tmz.com/2023/12/26/kanye-west-apologizes-jewish-community-antisemitic-rants/  https://tineye.com/search/878b0be925ecd21f07c7f897ecc11a08ef04a70a?sort=score&amp;order=desc&amp;page=1,CURRENTLY_RATED_HELPFUL
36688,"Jesus Christ was given up to the Romans by the High Priest Caiaphas who was a Jew. This post is factually wrong.     https://bible.usccb.org/bible/matthew/26#:~:text=3*%20Then%20the%20chief%20priests,a%20riot%20among%20the%20people.%E2%80%9D",CURRENTLY_RATED_HELPFUL
88617,This image is circulating with false claims that this is an explosion in Tehran now.    It is not current.    This image is from an explosion at an Iranian oil refinery in 2021.     https://www.iranintl.com/en/202312179537    https://www.standard.co.uk/news/uk/iran-warship-sinks-gulf-oman-oil-refinery-b938492.html    https://www.timesofisrael.com/massive-fire-breaks-out-at-oil-refinery-near-irans-capital/ ,CURRENTLY_RATED_HELPFUL
107327,"Mexico's president, Claudia Sheinbaum Pardo, Did not use gas or any other method of violence against said protestors.  She also has said in an interview that she doesn't condone any kind of violence against innocent civilians of palestine.    https://www.capital21.cdmx.gob.mx/noticias/?p=13707  https://www.youtube.com/watch?v=rQlPhH25fgQ",CURRENTLY_RATED_HELPFUL
126310,There are currently 5 US citizens being held hostage in Gaza. As such Trump is referring to our (the United States’) hostages.    https://www.washingtonexaminer.com/magazine-features/2995502/hamass-hostages-who-are-the-five-remaining-americans-still-held-by-the-terror-group/,CURRENTLY_RATED_HELPFUL
78360,"Calling into question the &quot;viability&quot; of an ethnic group, such as Jews, is racist and can be considered a call to genocide per the UN's Genocide Convention.    https://www.un.org/en/genocideprevention/documents/Genocide%20Convention-FactSheet-ENG.pdf    https://www.apa.org/topics/racism-bias-discrimination",CURRENTLY_RATED_HELPFUL
152474,"Prime Minister Benjamin Netanyahu was hurrying to a close vote on the night of December 14th, 2021, in the Knesset, the Israeli parliament.    This is completely unrelated to finding shelter from the Iranian missiles on October 1, 2024 (nearly three years later).    https://www.kikar.co.il/political-news/407728    https://www.hidabroot.org/article/1162572    https://x.com/netanyahu/status/1470499097303998471",CURRENTLY_RATED_HELPFUL
31925,Experts have exposed an account “masquerading” as a Qatari news source that has spread false reports on an alleged Qatari threat to cut its gas supplies to the world if Israel continues to bomb the besieged Gaza Strip.  https://dohanews.co/gaza-experts-debunk-fake-news-on-qatar-gas-supply-threats/  https://checkyourfact.com/2023/10/12/fact-check-did-qatar-threaten-to-stop-gas-supplies-to-the-world-if-bombing-of-gaza-did-not-stop/,CURRENTLY_RATED_HELPFUL
89371,"Samsung Next, which is only one branch of Samsung, has ceased operations in Israel due to difficult economic circumstances. Samsung as a whole continue to operate in Israel.    https://www.newarab.com/news/samsung-next-leaves-israel-economy-suffers-gaza-war?amp",CURRENTLY_RATED_HELPFUL
40806,"It has been confirmed by Israeli and other media that the parliament building in Gaza has been destroyed, but the building shown in this video is another building.    https://www.timesofisrael.com/liveblog_entry/military-demolishes-hamas-parliament-building-in-gaza-city/    https://twitter.com/manniefabian/status/1724837961835982979",CURRENTLY_RATED_HELPFUL
31027,"Yoav Gallant's actual statement:    &quot;I have released all the restraints, we have regained control of the area &amp; we are moving to a full offensive. Whoever comes to decapitate, murder women, Holocaust survivors - we will eliminate him with all our might &amp; without compromise&quot;    https://www.timesofisrael.com/liveblog_entry/us-defense-secretary-phones-gallant-for-third-time-in-four-days-to-discuss-gaza-war/",CURRENTLY_RATED_HELPFUL
32516,"The last elections in Palestine were held in 2006.    https://www.newarab.com/news/after-18-years-hamas-ready-municipal-elections-gaza    https://en.m.wikipedia.org/wiki/2006_Palestinian_legislative_election    Nearly half of Palestinians are under 18 and were all either not alive in 2006, or could not vote.     https://www.npr.org/2023/10/11/1205017249/how-to-talk-to-children-violence-israeli-palestinian-gaza-hamas  ",CURRENTLY_RATED_HELPFUL
152420,Misinformation: This video is 3 years old from 14/Dec/2021 when Netanyahu was rushing to vote at Knesset. He had posted it on twitter.     https://x.com/netanyahu/status/1470499097303998471?t=ncnYzeAq2DVOQqmu2raf1g&amp;s=19    https://www.hidabroot.org/article/1162572,CURRENTLY_RATED_HELPFUL
41984,"There is no basis for such statement. Ione Belarra's non-participation is a political matter unrelated to Palestine. One of the new ministers is Sira Rego, of Palestinian origin, who has often been critical of the Israeli conflict.    https://elpais.com/espana/2023-11-20/estos-son-los-ministros-que-dejan-el-gobierno-en-la-nueva-legislatura-de-pedro-sanchez.html    https://www.eldiario.es/politica/sira-rego-eurodiputada-iu-raices-palestinas-sera-nueva-ministra-juventud-e-infancia_1_10692544.html",CURRENTLY_RATED_HELPFUL
48859,"This is actually a device that removes old tile layer from a chimney.  The video, from Interesting Engineering, is at least 3 months old, completely unrelated to the Gaza conflict.  https://youtube.com/shorts/-R4ESzDmFhw?si=mXuGWyhCy4uOEPi5",CURRENTLY_RATED_HELPFUL
31744,This is from May 2021 and shows Palestinians and Lebanese protesting along the Lebanese border with Israel.  https://x.com/ree_mii2002/status/1393848369328574464?s=46  https://www.naharnet.com/stories/en/281589,CURRENTLY_RATED_HELPFUL
37028,'This video from RT Arabic was aired June 2021 while reporting on the elaborate tunnel network in Gaza.'    https://twitter.com/RTarabic/status/1404438237502971906  (Archive: https://archive.ph/rHYk9)    Factcheck:  https://www.boomlive.in/fact-check/viral-video-news-report-israel-palestine-militant-group-hamas-tunnel-network-social-media-claims-23509,CURRENTLY_RATED_HELPFUL
138539,"This is false, footage of the aftermath of the attack showed parts identified as belonging to the GBU-39 small diameter bomb, not the Hellfire R9X &quot;Ninja&quot; missile.    https://www.cnn.com/2024/08/10/middleeast/israeli-school-strike-gaza-intl-hnk/index.html  https://x.com/goodwinallegra/status/1822248347761070223  https://x.com/Easybakeovensz/status/1822999364681245085",CURRENTLY_RATED_HELPFUL
47103,The original Haaretz headline is &quot;Did Hamas Make Millions Betting Against Israeli Shares Before October 7 Massacre?&quot;. Leaving the question in the air without an answer as it states &quot;... But somebody seemingly knew in advance and made billions betting against Israeli shares...&quot;  https://www.haaretz.com/israel-news/2023-12-04/ty-article-magazine/.premium/did-hamas-make-billions-betting-against-israeli-shares-before-october-7-massacre/0000018c-348d-d5f2-a5cc-769d7bea0000  ,CURRENTLY_RATED_HELPFUL
129773,Please note that the event discussed was not held during the Paris Olympics. It took place in 2023 and was also reported by i24NEWS.     https://x.com/i24NEWS_EN/status/1726144051735404559,CURRENTLY_RATED_HELPFUL
57649,This photo has been digitally altered. The original photo is from a Pro-Palestinian rally in 2021:  https://www.instagram.com/p/CO8NhwMAaCr/?img_index=1,CURRENTLY_RATED_HELPFUL
35980,"This video is from 2019. The boy in the video, identified as Zain Abdeen Ashraf Idriss, 9, was accused by the soldiers to have thrown stones at them before going to school that morning. He was released later in the day:  https://gulfnews.com/world/mena/video-israeli-army-arrest-boy-9-from-school-goes-viral-1.1553582989935",CURRENTLY_RATED_HELPFUL
154788,"Russia has repeatedly targeted hospitals, aid workers, and first responders.     https://en.m.wikipedia.org/wiki/Russian%E2%80%93Syrian_hospital_bombing_campaign",CURRENTLY_RATED_HELPFUL
66778,"Tropical Glacier Cotinga,Maybe you should save your propaganda opinions for the comments, factually, there is no genocide in Gaza.Factually, parts of UNRWA are Hamas operatives.In addition, UNRWA allows Hamas to use many parts of its facilities and this has been proven years ago.    https://worldpopulationreview.com/world-cities/gaza-population",CURRENTLY_RATED_NOT_HELPFUL
68609,"The original post with the stock photo was deleted, however Israel has consistently claimed aid was being provided &amp; this has been at least partially confirmed from groups such as WFP.    https://twitter.com/cogatonline/status/1753134957671661728    https://twitter.com/WFP/status/1756581389258944876",CURRENTLY_RATED_NOT_HELPFUL
33024,"Un Gaza there os no light, but in the vídeo YouTube can see houses Whith light. https://www.elconfidencial.com/mundo/2023-10-11/se-apaga-la-ultima-luz-en-gaza-la-central-electrica-se-queda-sin-combustible_3752577/",CURRENTLY_RATED_NOT_HELPFUL
105056,"Hamas has no modern weapons capable of doing this amount of damage to a vehicle, however israel does as it was later reported by the Cradle Israel killed its own civilians “accidentally” via helicopter -https://thecradle.co/articles-id/13111#:~:text=An%20Israeli%20police%20investigation%20into,Haaretz%20reported%20on%2018%20November.",CURRENTLY_RATED_NOT_HELPFUL
100832,Israel is not a country    https://en.wikipedia.org/wiki/Israel,CURRENTLY_RATED_NOT_HELPFUL
68511,"Tate is charged for creating a criminal organization, human trafficking and rape in continous form, he is investigated for money laundry, tax evasion and trafficking minors in Romania.  Trail will start this year.  He showed with facts, he don't cares about protecting innocents. https://www.docdroid.net/kxw0PEr/indictment-en-pdf",CURRENTLY_RATED_NOT_HELPFUL
143872,This image is from 2021 at the latest.    https://www.newsweek.com/hamas-hamas-jews-gas-dutch-police-investigating-anti-semitic-chant-ahead-soccer-game-1585469,CURRENTLY_RATED_NOT_HELPFUL
66894,"Israel tortures every human being no matter what they are, even UN workers.",CURRENTLY_RATED_NOT_HELPFUL
65807,"NNN nobody can say with any certainty these people are alive so it is equally possible that they are dead.  Israel has offered no info on their condition, whereabouts, or status so the presumption of death is valid considering Israel's history.",CURRENTLY_RATED_NOT_HELPFUL
144185,Nnn - It’s asking a (rhetorical?) question. Answer should be in comments not on CN,CURRENTLY_RATED_NOT_HELPFUL
131019,"There is no mention or claim of rape in Israeli media,     Only in English Media was the word rape used, in Israel only the word Abuse.    This was of one single prisoner who claims he was abused, he wasn’t found and hospitalized    The current stance reported https://www.jpost.com/breaking-news/article-812413",CURRENTLY_RATED_NOT_HELPFUL
78298,"Israel is a country located in the Middle East and it is the only Jewish nation in the world  and the only democracy in the Middle East, which is why people like to pretend that is does not exist because it is simply a Jewish country.  https://www.britannica.com/place/Israel  https://en.m.wikipedia.org/wiki/Israel",CURRENTLY_RATED_NOT_HELPFUL
104785,"Israel have publicly stated that they have rejected a ceasefire on numerous occasions. As the Israeli prime minister Netanyahu has said repeatedly, the goal is to completely control the region.    https://www.aljazeera.com/amp/news/2024/5/7/the-goal-is-to-destroy-gaza-why-israel-rejects-a-ceasefire-with-hamas    https://news.sky.com/story/amp/israels-benjamin-netanyahu-rejects-ceasefire-deal-that-would-leave-hamas-intact-13129727    https://amp.theguardian.com/world/2024/feb/07/netanyahu-rejects-gaza-ceasefire-deal-and-says-victory-is-within-reach-israel  ",CURRENTLY_RATED_NOT_HELPFUL
108384,NNN - you are not providing a necessery note but adding information that is not directly related to the post,CURRENTLY_RATED_NOT_HELPFUL
34528,"NNN. If you disagree with the opinion expressed, use replies.",CURRENTLY_RATED_NOT_HELPFUL
112192,NNN - Hamas has a new charta since 2017. The organization views changed extremly.,CURRENTLY_RATED_NOT_HELPFUL
39246,NNN. Why must so many bird brain morons have access to the community notes? ,CURRENTLY_RATED_NOT_HELPFUL
58275,"Remember when your source claimed that Israel killed 500 at Al-Ahli hospital?  Now we know it was a misfire that landed in a parking lot.  Well, those 500 fake deaths are still in your figures.    And hamas uses child and women soldiers.    https://www.voanews.com/a/hrw-rocket-misfire-likely-caused-deadly-gaza-hospital-blast/7370998.html",CURRENTLY_RATED_NOT_HELPFUL
32002,The T-Shirt is green and the top is red. It could be blood. ,CURRENTLY_RATED_NOT_HELPFUL
104148,"Israel did not deliberately slaughter innocent people. Israeli Air Force uses it's best technologies (the best technologies on earth) to avoid hurt innocent people, on every attack. However, some times, when terrorists hide inside refugee camps, accidents happens.     https://en.wikipedia.org/wiki/Israeli_Air_Force      ",CURRENTLY_RATED_NOT_HELPFUL
46655,"NNN The wikepedia source mentions resettlement after establishment of Israel, not expulsion.  &quot;An estimated 650,000 (72%) of these Jews resettled in Israel&quot;    Also, it is a factually correct claim that Jews were expelled out of Europe (multiple times).  No CN is needed.    https://www.jewishvirtuallibrary.org/expulsions    https://en.m.wikipedia.org/wiki/Jewish_exodus_from_the_Muslim_world#:~:text=Primarily%20a%20consequence%20of%20the,these%20Jews%20resettled%20in%20Israel.",CURRENTLY_RATED_NOT_HELPFUL
30893,Hamas is the government of the Palestinians in Gaza.  The Palestinian Authority is the government for the West Bank.  Palestinians in Gaza are represented by Hamas.  https://en.wikipedia.org/wiki/Hamas_government_of_2012,CURRENTLY_RATED_NOT_HELPFUL
31105,Because of the war we still do not know what the Palestinians (the civils) are thinking ,CURRENTLY_RATED_NOT_HELPFUL
96848,Hamas agreed to a ceasefire; Israel chose war.    https://youtu.be/5LNKZyIYBE8  Israel-Hamas latest: IDF controls Rafah crossing as ceasefire talks stall,CURRENTLY_RATED_NOT_HELPFUL
45868,"The post disregard the fact of releasing several falsely news by the Israeli authorities that was confirmed untrue incidents. Starting with the 40 beheaded babies, killing 200 in concert (was done by the IDF itself) and ending by carrying sexual assault  https://www.factcheck.org/2023/10/what-we-know-about-three-widespread-israel-hamas-war-claims/",CURRENTLY_RATED_NOT_HELPFUL
149973,"IDF bombed the Gaza Strip on 23, 24, and 25 September 2023 https://apnews.com/article/israel-palestinians-west-bank-military-gaza-yom-kippur-ba539fdd4b36b786cf55ba6a420a12cc  https://www.middleeastmonitor.com/20240306-mehdi-hasan-debunks-top-7-lies-about-gaza/    IDF resumed bombing Gaza at 9:45am on 7 October https://www.aljazeera.com/news/longform/2023/10/9/israel-hamas-war-in-maps-and-charts-live-tracker  https://youtu.be/3ypYZ2vLkVY    On the 17 October 2023 the IDF authorized a strike on 4 multistorey residential buildings in the Gaza Strip that they knew would kill 300 civilians. https://www.972mag.com/mass-assassination-factory-israel-calculated-bombing-gaza/  https://www.cbc.ca/radio/frontburner/israel-accused-of-using-ai-to-choose-gaza-targets-transcript-1.7166577  ",CURRENTLY_RATED_NOT_HELPFUL
113421,I'm not sure Senator Schumer's BBQ is Kosher.  https://www.chabad.org/library/article_cdo/aid/113425/jewish/What-Is-Kosher.htm,CURRENTLY_RATED_NOT_HELPFUL
88243,NNN   Take your Zionist propaganda to the comments. Don't abuse CN.,CURRENTLY_RATED_NOT_HELPFUL
87132,"NNN    The proposed Notes miss the point that Daqqa served his full sentence for the killing of the Israeli soldier. He was sentenced in 1984 to 36 yrs. He got a 2 yr extension, despite having cancer, for smuggling mobile phones into prison https://www.thenationalnews.com/news/mena/2024/04/08/walid-daqqa-israel-prisoner/    https://www.reuters.com/world/middle-east/amnesty-international-urges-israel-return-body-ailing-palestinian-who-died-2024-04-08/",CURRENTLY_RATED_NOT_HELPFUL
135568,Hamas and the Islamic Jihad use child soldiers in the war against Israel  https://www.foxnews.com/world/exclusive-hamas-islamic-jihad-accused-using-child-soldiers-war-against-israel    Hamas and PIJ exploit young children for terrorist activities in Gaza  https://www.jpost.com/israel-hamas-war/article-780613    Palestinian Child soldiers in Samaria (west bank)  https://x.com/Osint613/status/1802306050114101304?t=Lq4qg_Yr51WbXiLEQmWd2A&amp;s=19    Palestinian Child soldiers:  https://twitter.com/NiohBerg/status/1797206129941836071/video/1   https://x.com/OliLondonTV/status/1793583055216509046?t=MpKmx5pVH7GpvG_K4Ptr5w&amp;s=19  https://jcpa.org/article/palestinian-teenage-terror-inherently-illegal-but-does-anyone-care/  https://x.com/VividProwess/status/1821509155808494064,CURRENTLY_RATED_NOT_HELPFUL
88809,Joe Biden is not writing nor making these posts. This account should be flagged as such.  https://www.independent.co.uk/news/world/americas/us-politics/karine-jean-pierre-twitter-biden-mishap-b2394032.html,CURRENTLY_RATED_NOT_HELPFUL
85252,"The British Mandate of Palestine, or Mandatory Palestine, was a Palestinian State that existed from 1920-1948, despite it being a puppet state, it was a state nonetheless, people born under it were Palestinian, as said in the Palestinian Citizenship Order of 1925    https://en.wikipedia.org/wiki/Palestinian_Citizenship_Order_1925",CURRENTLY_RATED_NOT_HELPFUL
113090,White Supremacy include hate of Jews “antisemitism”.   https://www.splcenter.org/fighting-hate/extremist-files/ideology/antisemitism  https://www.univision.com/univision-news/united-states/why-do-white-supremacists-hate-white-jews-so-much    https://en.m.wikipedia.org/wiki/White_supremacy,CURRENTLY_RATED_NOT_HELPFUL
65502,  Their  hands  were tight  and ther  eyes  were  covered   A Hebrew  words  were written  on the tights on ther  hands ,CURRENTLY_RATED_NOT_HELPFUL
46730,NNN.   zionists too scared to comment with their pictures/names because they know they're in the wrong so they come and abuse the community notes. enough.,CURRENTLY_RATED_NOT_HELPFUL
158327,The IDF has published a video where Yahya Sinwars wife is seen carrying a black bag. Choose another frame from this video than the IDF Arabic Spokesperson did and it easily shows this is not a Birkin bag.     https://m.jpost.com/israel-news/article-825247    https://x.com/Israel/status/1847783865643143264?t=77cZnF71LxsmKMes71Gveg&amp;s=19    https://x.com/LockMona/status/1847876263148491095?t=jVTa2fhsaIQfdPkREPSHOg&amp;s=19    ,CURRENTLY_RATED_NOT_HELPFUL
88916,Iran damaged the Ramon airbase which was used to strike the Iranian embassy in Syria.     This was a retaliation by Iran after Israel attacked their embassy.   Iran does not kill innocents like Israel has been doing over the last 6 months   https://www.chathamhouse.org/2024/04/strike-irans-consulate-syria-could-be-spark-ignites-middle-east,CURRENTLY_RATED_NOT_HELPFUL
55735,"She wasn't forced to resign for being a black African but by the power of Zionists lobby in America, she was accused of not responding to antisemitism on campus and of not adequately condemning the attacks of Hamas on Israel recently..she fighter for free speech only    https://en.wikipedia.org/wiki/Claudine_Gay",CURRENTLY_RATED_NOT_HELPFUL
39351,The people in the video claim they have been hit by an air strike. Hamas doesn’t have this capability. Israel has the capability to conduct air strikes.     https://www.flyingmag.com/what-the-israeli-air-force-has-in-the-sky/,CURRENTLY_RATED_NOT_HELPFUL
40156,gaza is the largest open air prison in the world    https://www.hrw.org/news/2022/06/14/gaza-israels-open-air-prison-15    https://www.nrc.no/news/2018/april/gaza-the-worlds-largest-open-air-prison/    https://www.thinkglobalhealth.org/article/open-air-prison-gazas-worsening-health-and-humanitarian-crises  ,CURRENTLY_RATED_NOT_HELPFUL
72636,"Judging by the Israeli flag emoji, we can reasonably assume this user is a regular connoisseur of children dying and mocking their deaths.    https://interactive.aljazeera.com/aje/2024/israel-war-on-gaza-10000-children-killed/",CURRENTLY_RATED_NOT_HELPFUL
42388,"NNN. The official definition of Arab is: &quot;a member of a Semitic people, originally from the Arabian peninsula and neighbouring territories, inhabiting much of the Middle East and North Africa.&quot;    Jesus was (or could have been) Arab and Jewish at the same time  https://www.google.com/search?sca_esv=584551767&amp;rlz=1C1GCEA_enBE1010BE1010&amp;q=arab&amp;si=ALGXSlbay8QErRaW9ftxx-jGNHSqpPhubLCp_fX2TWJtjr7zqJAHq5gNoc3qI0ptAhyA0J5u53HpJG_hHoGf5UV7X6J2AUHT_Q%3D%3D&amp;expnd=1&amp;sa=X&amp;ved=2ahUKEwj99sLxudeCAxWBtqQKHbWrD3cQ2v4IegQIDhAe&amp;biw=1280&amp;bih=610&amp;dpr=1.5",CURRENTLY_RATED_NOT_HELPFUL
34262,"Since 1776, the U.S. has only been at peace for 17 years.    https://www.warhistoryonline.com/history/usa-only-17-years-of-peace.html",CURRENTLY_RATED_NOT_HELPFUL
53974,"This is misleading, as she said in a video massage after her release that &quot;[The] people [the hostage taker] were very kind to me, [...] the food was good [as well as] the kindness&quot;. https://twitter.com/IsraelGovParody/status/1740735711954018393 ",CURRENTLY_RATED_NOT_HELPFUL
36376,This is propaganda from Israel’s security services. These claims have been debunked by Israeli media.   https://x.com/qudsnen/status/1718547315764441095?s=46&amp;t=6RQTqvw-x4nVy0BSo_JwqQ,CURRENTLY_RATED_NOT_HELPFUL
32036,There is no evidence they are used as human shields . Kidnapped yes .,CURRENTLY_RATED_NOT_HELPFUL
92638,"The post does not deny the genocide, if you think its important that the perpetrators be named then put that in the replies.",CURRENTLY_RATED_NOT_HELPFUL
31691,"This comment inaccurately claims Hamas terrorists are no different from ISIS, citing similar tactics and traits. Such comparisons in political discourse can fuel polarized debates. Encouraging fact-based discussions and diverse viewpoints is vital for clarity.",CURRENTLY_RATED_NOT_HELPFUL
127181,"Biden endorses Kamala Harris, his vice-president, to be the new Democratic nominee; she says she'll do &quot;everything in my power to ... unite our nation to defeat Donald Trump&quot;     https://www.bbc.co.uk/news/live/cv2gryx1yx1t",CURRENTLY_RATED_NOT_HELPFUL
74552,No Palestinian hostages. Just terrorists.   https://www.ajc.org/news/what-is-known-about-israeli-hostages-taken-by-hamas  ,CURRENTLY_RATED_NOT_HELPFUL
68329,"According to Unrwa, the majority of Palestinian refugees live in situations of poverty and even in countries like Lebanon they cannot carry out professional jobs.    https://unrwa.es/actualidad/sala-de-prensa/morir-por-la-pobreza-no-seria-muy-diferente-a-morir-en-el-mar/",CURRENTLY_RATED_NOT_HELPFUL
52654,Precision of thought and information should be valued.,CURRENTLY_RATED_NOT_HELPFUL
38584,"No Israeli government has sought to “improve the economic reality in Gaza” since the state of Israel began blockading Gaza in 2007.   Source: https://wikipedia.org/wiki/Blockade_of_the_Gaza_Strip#:~:text=In%202007%2C%20after%20Hamas%20seized,security%20on%20the%20Palestinian%20side.",CURRENTLY_RATED_NOT_HELPFUL
46494,"The man was born Shimon, and Koshi is a nickname. He is quoted in Wikipedia as saying that the nickname was given to him because of his ethnic origin and skin color:  https://he.wikipedia.org/wiki/%D7%9B%D7%95%D7%A9%D7%99_%D7%A8%D7%99%D7%9E%D7%95%D7%9F?wprov=sfla1",CURRENTLY_RATED_NOT_HELPFUL
45145,"Hamas hospitalised this man. He was kidnapped, but not murdered.     https://www.maariv.co.il/breaking-news/Article-1056431",CURRENTLY_RATED_NOT_HELPFUL
109306,"210 Civilians were killed and more than 400 were wounded in Nuseirat, Gaza     https://www.aljazeera.com/news/liveblog/2024/6/8/israels-war-on-gaza-live-israeli-army-to-be-added-to-un-child-harm-list",CURRENTLY_RATED_NOT_HELPFUL
64383,"The funding change is only temporary and due to an ongoing investigation initiated by the UNRWA itself. The agency has already reprimanded 12 individuals and terminated contracts due to their involvement in the heinous attacks on Oct. 7, accounting for 0.04% of the staff.    https://amp.theguardian.com/australia-news/2024/jan/27/australia-pauses-un-agency-funding-as-staff-investigated-for-suspected-role-in-7-october-attack-on-israel ",CURRENTLY_RATED_NOT_HELPFUL
160054,OP is leaving out context surrounding this clip in which the streamer is not condoning rape but instead saying rape doesn't justify genocide.    Longer clip: https://x.com/HasanabiProd/status/1849651527394136382,CURRENTLY_RATED_NOT_HELPFUL
