,summary,finalRatingStatus
47637,"There are two versions of the same video, with  surrendered man holding weapon not in the same hand.   This makes Israel's propaganda intent clear and calls into question the Hamas has been defeated.  Also other differences between the two videos.  👇  https://twitter.com/NaksBilal/status/1733586352183140769?t=o76CWGnhdFVPMVTA-PivHg&amp;s=19",CURRENTLY_RATED_NOT_HELPFUL
137997,"Gaza Health Ministry numbers are in fact, incorrect. They are a vast undercount, as the Gaza Health Ministry is so rigorous with their data that only absolutely confirmed deaths are counted with certainty. The real numbers are very obviously far higher.    https://www.thenation.com/article/world/gaza-death-toll-evidence/",CURRENTLY_RATED_NOT_HELPFUL
136577,"This statement misses the important context that Israel recently assassinated Ismail Haniyeh; who was leading Hamas' side of the ceasefire negotiations — causing &quot;further delay&quot;, &quot;escalate[d] regional tensions&quot;, and &quot;further escalation.&quot;     https://time.com/7005713/hamas-ismail-haniyeh-assassination-iran-israel/  https://www.axios.com/2024/07/31/us-hamas-leader-assassination-gaza-hostage-ceasefire-deal",CURRENTLY_RATED_NOT_HELPFUL
157456,A person who fights for his country and nation is not a terrorist. Yahiya Sanwar is freedom fighter who fights for his people. ,CURRENTLY_RATED_NOT_HELPFUL
31900,Israel has been attacked by terrorists and has every right to defend itself. Israel attacks Hamas. Hamas attacked civilians and murdered children.,CURRENTLY_RATED_NOT_HELPFUL
131350,HAMAS is not terrorist,CURRENTLY_RATED_NOT_HELPFUL
40995,"There are what appear to be two rifles, several grenades, and two small bags, containing approximately five rifles each, shown in this video.    https://x.com/idf/status/1724934932718293286?s=46",CURRENTLY_RATED_NOT_HELPFUL
66951,There are thousands of photos of Israeli Police as well as Israeli military abusing and inflicting pain on innocent civilians. The links used to debunk this specific photo are biased and unreliable     https://twitter.com/AdameMedia/status/1754869872511627524?t=4gx1fMaMgkzbFGNxW6Kt3A&amp;s=19,CURRENTLY_RATED_NOT_HELPFUL
63420,"NNN, OP is political banter and rebuttal about the hate speech stereotype that Jewish people eat/suck the blood from babies' foreskin during circumcision. despite this actually somehow being a real thing, the tweet is obviously satirical. https://www.nyc.gov/site/doh/health/health-topics/safe-bris.page ",CURRENTLY_RATED_NOT_HELPFUL
136331,"The OP conflates a radical Islamist battlecry, “Palestine is ours from the river to the sea,” with criticism of the UK’s extension of anti-terrorism laws to individuals outside the UK’s borders, and Musk’s criticism of that extension.    https://ehlinelaw.com/blog/can-london-police-extradite-americans-for-anti-jihadi-posts-about-uk",CURRENTLY_RATED_NOT_HELPFUL
66948,"There is no evidence to suggest that any gay person is thrown off a building in Palestine. In fact it is legal to be gay in Palestine. This post is misleading, racist and attempts to demonize the Palestinian people in the face of imminent annihilation.    https://en.m.wikipedia.org/wiki/LGBT_rights_in_the_State_of_Palestine",CURRENTLY_RATED_NOT_HELPFUL
31612,"Picture is not neccesarily AI (aiornot.com can make mistakes), but it does not prove anything. It's propaganda to justify genocide.",CURRENTLY_RATED_NOT_HELPFUL
170331,"Ethical and moral? To quote Oxfam “More women and children have been killed in Gaza by the Israeli military over the past year than the equivalent period of any other conflict over the past two decades.    …more than 6,000 women and 11,000 children were killed in Gaza”    https://www.oxfam.org/en/press-releases/more-women-and-children-killed-gaza-israeli-military-any-other-recent-conflict",CURRENTLY_RATED_NOT_HELPFUL
152723,NNN Stop abusing community notes,CURRENTLY_RATED_NOT_HELPFUL
34474,I don't care if they're not real bullets. This action is cruel and despicable.,CURRENTLY_RATED_NOT_HELPFUL
160985,"This post contains an advert for a betting company, which is against the terms of service. This is an advert, not commentary.    https://x.com/tos",CURRENTLY_RATED_NOT_HELPFUL
59762,NNN: Clearly a meme account,CURRENTLY_RATED_NOT_HELPFUL
165400,This is a misrepresentation     The Maccabi fans STARTED the trouble by chanting “Death to all Arabs” &amp; supporting the genocide in Gaza     The other fans (understandably) reacted to this DELIBERATE provocation     https://youtu.be/FOVHJx4HSpw?si=CvACZ9rT63cYp6DN,CURRENTLY_RATED_NOT_HELPFUL
65569,"This person is sharing a historical video while expressing a personal opinion that he thinks Hitler was right. He is not hurting anyone or spreading misinformation, he is expressing his opinion.    This is freedom of speech. ",CURRENTLY_RATED_NOT_HELPFUL
39821,Discuss interpretation of the headbands in the comments. They are wearing attire that COULD resemble Hamas fighters. They're often found in pictures of posing heavily armed Hamas fighters wearing alike balaclavas. Sometimes even children holding automatic weapons.    https://media-cldnry.s-nbcnews.com/image/upload/rockcms/2023-10/231009-gaza-city-hamas-fighters-masks-weapons-2017-ac-1108p-1bb51e.jpg  https://www.reuters.com/resizer/1nmZoyE-MiSWQ0UHyyFFjgon6XM=/1080x565/smart/filters:quality(80)/cloudfront-us-east-2.images.arcpublishing.com/reuters/JVCKESBXYFNOJIPT2LH5UGT5WA.jpg  https://www.aljazeera.com/wp-content/uploads/2023/10/GettyImages-1544209168-1697002603.jpg?resize=770%2C513&amp;quality=80  https://upload.wikimedia.org/wikipedia/commons/thumb/6/61/25th_anniversary_of_Hamas_%2818%29.jpg/351px-25th_anniversary_of_Hamas_%2818%29.jpg,CURRENTLY_RATED_NOT_HELPFUL
54854,"Israel has banned, since 2007, the entering of construction materials.   So in order to build tunnels, which need far less construction materials than building a school, hospital.., construction materials were smuggled into gaza.  https://amp.cnn.com/cnn/2023/10/28/middleeast/hamas-tunnels-gaza-intl/index.html",CURRENTLY_RATED_NOT_HELPFUL
41731,This video contains an edit at 1.12 where the film grain/resolution changes as well as the back lighting of the camera. This calls in to question the authenticity of the claim that the latter part of this video is a tunnel under Al-Shifa Hospital    https://twitter.com/IDF/status/1726284807351472556?t=V7dmF2Ry5cIjrQb8-jqt-w&amp;s=19,CURRENTLY_RATED_NOT_HELPFUL
41689,"No evidence exists for rape by Hamas yet, but is being pursued:    https://www.timesofisrael.com/amid-war-and-urgent-need-to-id-bodies-evidence-of-hamass-october-7-rapes-slips-away/",CURRENTLY_RATED_NOT_HELPFUL
88619,Isreal dragged Iran to the war. Israel is the culprit   https://www.dw.com/en/iranian-embassy-attack-has-israel-middle-east-on-edge/a-68726461,CURRENTLY_RATED_NOT_HELPFUL
86574,This is zionism. Plain and clear.,CURRENTLY_RATED_NOT_HELPFUL
87672,"NNN - The IDF isn’t a credible, unbiased source of news about the IDF’s war crimes. Stupid. ",CURRENTLY_RATED_NOT_HELPFUL
165382,‘From a chronological standpoint’ you sound stupid. That’s like stating Donald Trump stopped gun violence because for 1 day nobody shot someone after he was elected. This post is very misleading. Vote yes on the top note.    https://stopthebiasnotes.com,CURRENTLY_RATED_NOT_HELPFUL
154937,"Jesus was Jew, there are historical facts proving it. In those times no one was called &quot;Palestinian&quot;. I suppose this post is to support Palestinians (Hamas, Hezbollah, etc) against Israel. https://en.wikipedia.org/wiki/Hezbollah",CURRENTLY_RATED_NOT_HELPFUL
108890,What was targeted was a warehouse of children's toys inside the school  This is a video testimony of a bombing survivor  https://x.com/tamerqdh/status/1799127144527753247,CURRENTLY_RATED_NOT_HELPFUL
105699,"The US and UK military bombed Houthi positions in Yemen, in order to reduce their ability to strike civilian shipping in the gulf.     There is no Israeli genocide in Gaza, or anywhere else, and as such there is none to support.    https://ukdefencejournal.org.uk/british-jets-bomb-houthi-rebels-in-yemen/",CURRENTLY_RATED_NOT_HELPFUL
95649,"Sugar was not and has never been banned, even while cookies was banned. The banning of cookies was seemingly unjustified punishment and was later allowed back into Gaza.  https://www.haaretz.com/hblocked?returnTo=https%3A%2F%2Fwww.haaretz.com%2F2009-05-17%2Fty-article%2Famira-hass-israel-bans-books-music-and-clothes-from-entering-gaza%2F0000017f-f124-da6f-a77f-f92e347a0000  https://www.ynetnews.com/articles/0,7340,L-3902661,00.html",CURRENTLY_RATED_NOT_HELPFUL
91947,NNN; JewOConfirmed is a well known propagandist hasbara account. They are numerous examples of the account blatantly lying. ,CURRENTLY_RATED_NOT_HELPFUL
155184,The lack of blood dripping from such an alleged injury indicates that this is staged and not a real injury.    https://x.com/GAZAWOOD1/status/1844362835528474677,CURRENTLY_RATED_NOT_HELPFUL
153541,"The claim is misleading. The land in question is part of Israel, recognized under international law and historic ties. Israel defends its territory against terror threats, and accusations of “stealing” land distort the legal and historical context of Israeli sovereignty.    https://is.gd/cNdzwJ",CURRENTLY_RATED_NOT_HELPFUL
43813,NNN. Stop abusing community notes. All provided notes so far are irrelevant to the post.,CURRENTLY_RATED_NOT_HELPFUL
64532,NNN zionists stop abusing community notes challenge,CURRENTLY_RATED_NOT_HELPFUL
101966,East Jerusalem has been illegally occupied by Israel since 1967:    https://www.btselem.org/topic/jerusalem    https://en.wikipedia.org/wiki/Legality_of_the_Israeli_occupation_of_Palestine?wprov=sfti1#Background,CURRENTLY_RATED_NOT_HELPFUL
126241,"Apples to oranges comparison. The first picture shows civilians rounded up simply for their heritage/ethnicity. The second picture shows &quot;soldiers&quot; (Hamas terrorists) who've hidden behind civilians, captured after attacking civilians.  https://nationalpost.com/news/world/israel-middle-east/global-rights-group-hamas-war-crimes",CURRENTLY_RATED_NOT_HELPFUL
53809,Blinken offering kudos to an industry that the public has little confidence in; trust in the media is at an all time low.  Gallup Oct 2023:  https://news.gallup.com/poll/512861/media-confidence-matches-2016-record-low.aspx,CURRENTLY_RATED_NOT_HELPFUL
49086,NNN. There's a war going on- you want the soldiers hunting terrorists to put their shoes at the fucking door?,CURRENTLY_RATED_NOT_HELPFUL
59689,NNN. Community Notes are not for expressing personal thoughts on a topic. Dictionary definitions of a term are NOT supportive evidence that it applies to a situation.,CURRENTLY_RATED_NOT_HELPFUL
37702,IDF has confirmed that they targeted the ambulance      https://x.com/idf/status/1720510816930157050,CURRENTLY_RATED_NOT_HELPFUL
